{"active_lessons":{"lessons":[],"schema_version":1},"schema_version":1,"task":{"after_html":"<main class=\"fleet-shell\"><h1>Fleet Status</h1><section data-region-id=\"region-201067bbab\">Active vehicles: 21</section><aside data-region-id=\"region-6f13d19014\">Avg delay: 6 min</aside><footer data-region-id=\"region-479da38d6c\">Refreshed at 2026-08-24T11:35Z</footer></main>","before_html":"<main class=\"fleet-shell\"><h1>Fleet Status</h1><section data-region-id=\"region-201067bbab\">Active vehicles: 18</section><aside data-region-id=\"region-6f13d19014\">Avg delay: 4 min</aside><footer data-region-id=\"region-479da38d6c\">Refreshed at 2026-08-24T11:05Z</footer></main>","region_ids":["region-201067bbab","region-6f13d19014","region-479da38d6c"]},"task_id":"page-42bde55d833f"}
