{"active_lessons":{"lessons":[],"schema_version":1},"schema_version":1,"task":{"after_html":"<main class=\"queue-board\"><h1>Support Queue</h1><section data-region-id=\"region-c7acb7a771\">Open tickets: 47</section><aside data-region-id=\"region-5ac24ba812\">5 agents online</aside><footer data-region-id=\"region-00e9520658\">Snapshot at 2026-08-24T09:40Z</footer></main>","before_html":"<main class=\"queue-board\"><h1>Support Queue</h1><section data-region-id=\"region-c7acb7a771\">Open tickets: 42</section><aside data-region-id=\"region-5ac24ba812\">3 agents online</aside><footer data-region-id=\"region-00e9520658\">Snapshot at 2026-08-24T09:10Z</footer></main>","region_ids":["region-c7acb7a771","region-5ac24ba812","region-00e9520658"]},"task_id":"page-17a3e9219b0e"}
